697741,a5MuRnSam0ana9fAO4178pVBv3v.jpg,"9648,10770,53",A pregnant woman finds herself in serious danger when she agrees to live with the couple who plan to adopt her unborn child.,101,hNk1cMYd2RZhNx8Q6FI4YzClDIi.jpg,2020-04-25,Expectant,3.25,37,2024-04-13 00:00:00,en,89,Released,2024-04-13 00:00:00,"7, 10, 7, 11, 2"
697843,wRxLAw4l17LqiFcPLkobriPTZAw.jpg,"28,53","Tasked with extracting a family who is at the mercy of a Georgian gangster, Tyler Rake infiltrates one of the world's deadliest prisons in order to save them. But when the extraction gets hot, and the gangster dies in the heat of battle, his equally ruthless brother tracks down Rake and his team to Vienna, in order to get revenge.",95,7gKI9hpEMcZUQpNgKrkDzJpbnNS.jpg,2023-06-09,Extraction 2,3.73,2198,2024-04-13 00:00:00,en,122,Released,2024-04-13 00:00:00,"1036, 417, 89, 427, 229"
698438,tIdLd6O61oZ0JqQgHN873Ld5mAc.jpg,10749,"Couple Jin-goo and Joo-hee have been experiencing a lover's slump after their marriage. Meanwhile, a new couple in the neighborhood, Hyun-jin and Yoo-jeong came to the other couple's house to introduce themselves. They're attracted with each other's husbands and wives, and in the end, crosses the line that is not supposed to be crossed within neighbors. After that day, two couples' passion intensifies...",105,3ArCpGHdnVqBjhkdRcQHSBYH1yA.jpg,2019-11-04,Swapping: Perfect Neighbor,2.35,31,2024-04-13 00:00:00,en,71,Released,2024-04-13 00:00:00,"7, 4, 1, 0, 19"
699172,2MAEzTg6uUUcaPNB3gmYb46NF0S.jpg,10749,"Joon-pyo is a troublemaker who just got out of prison, and moves in with his brother Joon-seok and his wife Eun-ha. On the first day of meeting his sister-in-law, she looks calm and quiet, but she actually used to be a member of a high school gang. She hands Joon-pyo some money in return for not talking about her past. A few days later, Eun-ha is furious to see her husband having an intimate moment with her sister. Joon-pyo sees this as his chance and approaches a drunken Eun-ha...",78.179,tg9teKVp1pXIj252yKfqgkH9U9b.jpg,2019-11-07,Intercourse: Special Sister-In-Law,1,2,2024-04-13 00:00:00,en,60,Released,2024-04-13 00:00:00,"0, 0, 0, 0, 1"
705996,A1bWhTFQKkhF1yhSKWosSyzn2Hp.jpg,"53,9648,10749","From a mountain peak in South Korea, a man plummets to his death. Did he jump, or was he pushed? When detective Hae-joon arrives on the scene, he begins to suspect the dead man’s wife Seo-rae. But as he digs deeper into the investigation, he finds himself trapped in a web of deception and desire.",59,N0rskx91Eh6aWjvBybeY6epNic.jpg,2022-06-29,Decision to Leave,3.69,1057,2024-04-13 00:00:00,en,138,Released,2024-04-13 00:00:00,"569, 160, 28, 31, 269"
713704,7bWxAsNPv9CXHOhZbJVlj2KxgfP.jpg,"27,53","A reunion between two estranged sisters gets cut short by the rise of flesh-possessing demons, thrusting them into a primal battle for survival as they face the most nightmarish version of family imaginable.",93,5ik4ATKmNtmJU6AYD0bLm56BCVM.jpg,2023-04-12,Evil Dead Rise,3.48,2747,2024-04-13 00:00:00,en,96,Released,2024-04-13 00:00:00,"319, 1165, 899, 243, 121"
714567,sKdDC38FHuPvEsRgIzMEQE6ydol.jpg,"53,27,18","The story of a girl who, in an attempt to understand the mysterious suicide of her younger sister, embarks on a dangerous game, hoping to stop the curators of the ""death group"" pushing teenagers to suicide.",157,2TmZ2lgDEYJAFpeUMALRx5NwqK.jpg,2021-10-07,#Blue_Whale,3.1,39,2024-04-13 00:00:00,en,93,Released,2024-04-13 00:00:00,"12, 4, 11, 0, 12"
717728,jpipejVjqn7ifln05xeq9zpvprf.jpg,"27,53,9648","Forced to travel with her boyfriend to a horror festival, Laine begins to experience disturbing visions associated with the urban legend of The Creeper. As the festival arrives and the blood-soaked entertainment builds to a frenzy, she becomes the center of it while something unearthly has been summoned.",57,ym2zWdb6dbHGO3nd0EhbTY23j4y.jpg,2022-09-15,Jeepers Creepers: Reborn,2.74,933,2024-04-13 00:00:00,en,88,Released,2024-04-13 00:00:00,"231, 131, 0, 306, 265"
717930,c6Splshb8lb2Q9OvUfhpqXl7uP0.jpg,"28,53","After his mission is exposed, an undercover CIA operative stuck deep in hostile territory in Afghanistan must fight his way out, alongside his Afghan translator, to an extraction point in Kandahar, all whilst avoiding elite enemy forces and foreign spies tasked with hunting them down.",77,keT57nO3QcgrxzTKXH9v4hopI8g.jpg,2023-05-25,Kandahar,3.44,909,2024-04-13 00:00:00,en,119,Released,2024-04-13 00:00:00,"336, 195, 3, 282, 93"
718930,y2Ca1neKke2mGPMaHzlCNDVZqsK.jpg,"28,35,53","Unlucky assassin Ladybug is determined to do his job peacefully after one too many gigs gone off the rails. Fate, however, may have other plans, as Ladybug's latest mission puts him on a collision course with lethal adversaries from around the globe—all with connected, yet conflicting, objectives—on the world's fastest train.",102,j8szC8OgrejDQjjMKSVXyaAjw3V.jpg,2022-08-03,Bullet Train,3.74,5498,2024-04-13 00:00:00,en,126,Released,2024-04-13 00:00:00,"3145, 410, 485, 284, 1174"
719457,8IY7Xup6vh1OEFjxGS9lqjRETg5.jpg,10749,"Even Dong-ho, who got his dream home, went to the next generation and decided to eat every day with ramen. Dong-ho, who insisted on his own home, has one romance It's a college day, every day, I enjoy changing this woman I wanted to try my friend Sung Joon's section stripe. But I realized lately that I didn’t even have a woman The door to the next door opened when I was in the dark, and I picked up the collection bag. After discovering an attractive woman (So-hee), she becomes fascinated.  Dong-ho decided to go out with her in a month,  He's usually a timid personality, but he's a little dashing, but he doesn't give a glance and treats him coldly...  Dong-ho, whose self-esteem is deprived, calls a business trip massage that Sung Joon gave  I'm having a fascinating night with Mina, the sexy massage girl who came home...  Then I heard the voice of the girl next door knocking on Dong-ho's door.  Can Dong-ho get a girl next door?",86,uqQvlKjum8hNNiI6f2oaww5ciGw.jpg,2020-07-03,The Girl Next Door 4,5,1,2024-04-13 00:00:00,en,72,Released,2024-04-13 00:00:00,"1, 0, 0, 0, 0"
724109,gCcryot1HA9IPrThp9zIreSBptM.jpg,10749,"An omnibus movie about the jealousy of a man who can't stand the fact that his favorite woman slept with another man in two episodes.  Episode 1  At a drinking party led by Jae-hoon, movie director Sang-min meets Hye-jin. Sang-min compliments and sleeps with her favorite Hye-jin while watching her movie. The next morning, Hye-jin's friend Mina left early because of her job, Jae-hoon and Sang-min, who were watching a movie together in Hye-jin's bed are attracted by the atmosphere and curiosity and enjoy 2 to 1.  Episode 2  Sang-min meets his school friend Ji-eun at the club.  When his foreign friend James showed interest in Ji-eun, Sang-min suddenly became interested in Ji-eun.  That night, Sang-min finds out that Ji-eun slept with James, and visits Ji-eun's house with complex emotions mixed with like, anger and jealousy and confesses that he likes her.",39,ZAhAOX5RsstfrbLtkSjiUZGgw2.jpg,2020-07-06,Hole-in-law,3.05,17,2024-04-13 00:00:00,en,95,Released,2024-04-13 00:00:00,"3, 7, 1, 0, 6"
724209,j7eWbnyeTN0rFpNCkSzIl7HhQ2C.jpg,"53,28",An intelligence operative for a shadowy global peacekeeping agency races to stop a hacker from stealing its most valuable — and dangerous — weapon.,73,vB8o2p4ETnrfiWEgVxHmHWP9yRl.jpg,2023-08-09,Heart of Stone,3.43,1536,2024-04-13 00:00:00,en,122,Released,2024-04-13 00:00:00,"271, 741, 190, 45, 289"
724495,xTsERrOCW15OIYl5aPX7Jbj38wu.jpg,"28,18,36","The story of the Agojie, the all-female unit of warriors who protected the African Kingdom of Dahomey in the 1800s with skills and a fierceness unlike anything the world has ever seen, and General Nanisca as she trains the next generation of recruits and readies them for battle against an enemy determined to destroy their way of life.",53,438QXt1E3WJWb3PqNniK0tAE5c1.jpg,2022-09-16,The Woman King,3.85,1908,2024-04-13 00:00:00,en,135,Released,2024-04-13 00:00:00,"1165, 144, 54, 237, 308"
726209,tLsc8SCFO0rMVgVyNm9XtfnyX84.jpg,"18,9648,53",A family's getaway to a luxurious rental home takes an ominous turn when a cyberattack knocks out their devices—and two strangers appear at their door.,84,29rhl1xopxA7JlGVVsf1UHfYPvN.jpg,2023-11-22,Leave the World Behind,3.24,2045,2024-04-13 00:00:00,en,142,Released,2024-04-13 00:00:00,"662, 182, 351, 684, 166"
729854,g8kCHQzfogy1t1dE9nPBtiFkz64.jpg,"53,878,18","The world has been reduced to rubble by a massive earthquake. While no one knows for sure how far the ruins stretch, or what the cause of the earthquake may be, in the heart of Seoul there is only one apartment building left standing. It is called Hwang Gung Apartments. As time passes, outsiders start coming in to Hwang Gung Apartments trying to escape the extreme cold. Before long, the apartment residents are unable to cope with the increasing numbers. Feeling a threat to their very survival, the residents enact a special measure.",88,4l68KHxnPSow8MvnGUpjqLzJtLJ.jpg,2023-08-09,Concrete Utopia,3.64,102,2024-04-13 00:00:00,en,130,Released,2024-04-13 00:00:00,"60, 7, 4, 0, 31"
734253,2QL5j6mB4ZpyBcVr0WO9H9MQGBu.jpg,"28,12,14","7000 years ago, Ayodhya's Prince Raghava and Prince Sesh along with the Mighty Vanar Warriors travels to the island of Lanka with an aim to rescue Raghava's wife Janaki, who has been abducted by Lankesh, the king of Lanka.",62,kpuOeWclbtLU414Txv8ZT6HoZ0k.jpg,2023-06-16,Adipurush,2.65,74,2024-04-13 00:00:00,en,179,Released,2024-04-13 00:00:00,"11, 8, 4, 46, 5"
736526,e9Qb2kmBnMXHCmNMI8NX1JbWhh1.jpg,"14,28,12","Deep inside the mountain of Dovre, something gigantic awakens after being trapped for a thousand years. Destroying everything in its path, the creature is fast approaching the capital of Norway. But how do you stop something you thought only existed in Norwegian folklore?",65,ulgKdif3ubMACDltr8VZy6fyVjW.jpg,2022-12-01,Troll,3.32,1600,2024-04-13 00:00:00,en,104,Released,2024-04-13 00:00:00,"307, 412, 433, 382, 66"
738642,jveu0Sngk31U9rRo8PjrfBUekEj.jpg,"10749,35","Audrey attempts to stop her brother from marrying a young French woman during their rescheduled wedding weekend in the Hamptons, which happens to be the same weekend she turns 40.",75,9lcqeZEvmQwZmFyhNDGLASpPUhl.jpg,2020-12-18,Sister of the Groom,2.7,26,2024-04-13 00:00:00,en,82,Released,2024-04-13 00:00:00,"6, 2, 7, 0, 11"
744275,lV3UFPPxDIPelh46G9oySXN9Mcz.jpg,"10749,18","Just as Tessa's life begins to become unglued, nothing is what she thought it would be. Not her friends nor her family. The only person that she should be able to rely on is Hardin, who is furious when he discovers the massive secret that she's been keeping. Before Tessa makes the biggest decision of her life, everything changes because of revelations about her family.",87,dU4HfnTEJDf9KvxGS9hgO7BVeju.jpg,2021-09-01,After We Fell,3.54,2463,2024-04-13 00:00:00,en,99,Released,2024-04-13 00:00:00,"971, 673, 17, 319, 483"
744276,rwgmDkIEv8VjAsWx25ottJrFvpO.jpg,"10749,18","As a shocking truth about a couple's families emerges, the two lovers discover they are not so different from each other. Tessa is no longer the sweet, simple, good girl she was when she met Hardin — any more than he is the cruel, moody boy she fell so hard for.",78,moogpu8rNkEjTgFyLXwhPghft5w.jpg,2022-08-24,After Ever Happy,3.41,1135,2024-04-13 00:00:00,en,95,Released,2024-04-13 00:00:00,"354, 107, 370, 258, 46"
744857,92LX2nflnkxHtmV2WRb4I4lSXsY.jpg,"27,53","Residents of a small rural town discover that a demon is about to be born among them. They desperately try to escape before the evil is born, but it may be too late.",78,gY8FebmJVHoiHeCvJwYOR1N9eGv.jpg,2023-10-05,When Evil Lurks,3.7,602,2024-04-13 00:00:00,en,99,Released,2024-04-13 00:00:00,"285, 107, 46, 72, 92"
752623,1Ds7xy7ILo8u2WWxdnkJth1jQVT.jpg,"28,12,35","Reclusive author Loretta Sage writes about exotic places in her popular adventure novels that feature a handsome cover model named Alan. While on tour promoting her new book with Alan, Loretta gets kidnapped by an eccentric billionaire who hopes she can lead him to the ancient city's lost treasure that featured in her latest story. Alan, determined to prove he can be a hero in real life and not just on the pages of her books, sets off to rescue her.",64,neMZH82Stu91d3iqvLdNQfqPPyl.jpg,2022-03-24,The Lost City,3.27,3332,2024-04-13 00:00:00,en,112,Released,2024-04-13 00:00:00,"1399, 607, 26, 94, 1206"
753342,eHMh7kChaNeD4VTdMCXLJbRTzcI.jpg,"18,36,10752","An epic that details the checkered rise and fall of French Emperor Napoleon Bonaparte and his relentless journey to power through the prism of his addictive, volatile relationship with his wife, Josephine.",242,vcZWJGvB5xydWuUO1vaTLI82tGi.jpg,2023-11-22,Napoleon,3.24,1960,2024-04-13 00:00:00,en,158,Released,2024-04-13 00:00:00,"482, 508, 270, 398, 302"
756999,syKiIOqEoOi1Hb0Oh0n9cImcBab.jpg,"27,53,80,18","Finney Blake, a shy but clever 13-year-old boy, is abducted by a sadistic killer and trapped in a soundproof basement where screaming is of little use. When a disconnected phone on the wall begins to ring, Finney discovers that he can hear the voices of the killer’s previous victims. And they are dead set on making sure that what happened to them doesn’t happen to Finney.",50,lr11mCT85T1JanlgjMuhs9nMht4.jpg,2022-06-22,The Black Phone,3.82,4535,2024-04-13 00:00:00,en,103,Released,2024-04-13 00:00:00,"1746, 812, 1548, 272, 157"
758323,3oqmk6mNWPatBKcjOOJLp5WW9zN.jpg,"27,53","Father Gabriele Amorth, Chief Exorcist of the Vatican, investigates a young boy's terrifying possession and ends up uncovering a centuries-old conspiracy the Vatican has desperately tried to keep hidden.",109,jFC4LS5qTAT3PinzdEzINfu1CV9.jpg,2023-04-05,The Pope's Exorcist,3.51,2452,2024-04-13 00:00:00,en,103,Released,2024-04-13 00:00:00,"1184, 321, 22, 411, 514"
760104,70Rm9ItxKuEKN8iu6rNjfwAYUCJ.jpg,"27,53,9648","In 1979, a group of young filmmakers set out to make an adult film in rural Texas, but when their reclusive, elderly hosts catch them in the act, the cast find themselves fighting for their lives.",82,woTQx9Q4b8aO13jR9dsj8C9JESy.jpg,2022-03-17,X,3.36,2694,2024-04-13 00:00:00,en,106,Released,2024-04-13 00:00:00,"629, 755, 496, 584, 230"
760741,pr5B7Hb7711QQDirAyS5P7fKjts.jpg,"53,28,27,12","A recently widowed man and his two teenage daughters travel to a game reserve in South Africa. However, their journey of healing soon turns into a fight for survival when a bloodthirsty lion starts to stalk them.",72,iRV0IB5xQeOymuGGUBarTecQVAl.jpg,2022-08-11,Beast,3.34,1406,2024-04-13 00:00:00,en,93,Released,2024-04-13 00:00:00,"170, 714, 25, 418, 79"
760774,7grv5ULlK9wMr2T1fkgr56HlbT.jpg,"18,36,10752","British stockbroker Nicholas Winton visits Czechoslovakia in the 1930s and forms plans to assist in the rescue of Jewish children before the onset of World War II, in an operation that came to be known as the Kindertransport.",101,yvnIWt2j8VnDgwKJE2VMiFMa2Qo.jpg,2023-09-09,One Life,3.86,276,2024-04-13 00:00:00,en,109,Released,2024-04-13 00:00:00,"154, 22, 48, 11, 41"
762430,iiXliCeykkzmJ0Eg9RYJ7F2CWSz.jpg,53,"When a mysterious caller puts a bomb under his car seat, Matt Turner begins a high-speed chase across the city to complete a specific series of tasks- all with his kids trapped in the back seat.",118,oUmmY7QWWn7OhKlcPOnirHJpP1F.jpg,2023-08-23,Retribution,3.38,1004,2024-04-13 00:00:00,en,91,Released,2024-04-13 00:00:00,"235, 287, 284, 20, 178"
763215,deLWkOLZmBNkm8p16igfapQyqeq.jpg,"14,28,12",A young woman's marriage to a charming prince turns into a fierce fight for survival when she's offered up as a sacrifice to a fire-breathing dragon.,906,AgHbB9DCE9aE57zkHjSmseszh6e.jpg,2024-03-07,Damsel,3.57,1462,2024-04-13 00:00:00,en,110,Released,2024-04-13 00:00:00,"669, 168, 282, 13, 330"
766507,7ZO9yoEU2fAHKhmJWfAc2QIPWJg.jpg,"53,28,878","When danger threatens her camp, the fierce and highly skilled Comanche warrior Naru sets out to protect her people. But the prey she stalks turns out to be a highly evolved alien predator with a technically advanced arsenal.",106,ujr5pztc1oitbe7ViMUOilFaJ7s.jpg,2022-08-02,Prey,3.86,6240,2024-04-13 00:00:00,en,100,Released,2024-04-13 00:00:00,"2231, 1819, 1338, 789, 63"
770156,7KR1nKGaYqPuFBnqP7XBIX0DZlR.jpg,"18,10751",Second chances start when a hardened criminal crosses paths with a precocious little girl who is helped by an angel to change hearts during the holiday season.,121,yfnJ5qIYx7q33fY4jqv9Pu95RSg.jpg,2020-10-19,Lucy Shimmers and the Prince of Peace,4.18,220,2024-04-13 00:00:00,en,87,Released,2024-04-13 00:00:00,"123, 50, 13, 31, 3"
774825,eG0oOQVsniPAuecPzDD1B1gnYWy.jpg,"16,35,12,10751",The fearless one-eyed weasel Buck teams up with mischievous possum brothers Crash & Eddie as they head off on a new adventure into Buck's home: The Dinosaur World.,78,zzXFM4FKDG7l1ufrAkwQYv2xvnh.jpg,2022-01-28,The Ice Age Adventures of Buck Wild,3.32,1638,2024-04-13 00:00:00,en,82,Released,2024-04-13 00:00:00,"371, 565, 270, 81, 351"
776503,v85FlkbMYKa5du1glm0YfYNsL2n.jpg,"18,10402,10749","As a CODA (Child of Deaf Adults), Ruby is the only hearing person in her deaf family. When the family's fishing business is threatened, Ruby finds herself torn between pursuing her love of music and her fear of abandoning her parents.",61,BzVjmm8l23rPsijLiNLUzuQtyd.jpg,2021-08-13,CODA,3.97,2069,2024-04-13 00:00:00,en,112,Released,2024-04-13 00:00:00,"910, 641, 231, 119, 168"
785084,46FRuCeAn6TrS4F1P4F9zhyCpyo.jpg,18,A reclusive English teacher suffering from severe obesity attempts to reconnect with his estranged teenage daughter for one last chance at redemption.,60,jQ0gylJMxWSL490sy0RrPj1Lj7e.jpg,2022-12-09,The Whale,3.93,3520,2024-04-13 00:00:00,en,117,Released,2024-04-13 00:00:00,"1578, 643, 1022, 28, 249"
787699,yyFc8Iclt2jxPmLztbP617xXllT.jpg,"35,10751,14","Willy Wonka – chock-full of ideas and determined to change the world one delectable bite at a time – is proof that the best things in life begin with a dream, and if you’re lucky enough to meet Willy Wonka, anything is possible.",441,qhb1qOilapbapxWQn9jtRCMwXJF.jpg,2023-12-06,Wonka,3.6,2775,2024-04-13 00:00:00,en,117,Released,2024-04-13 00:00:00,"1109, 241, 653, 750, 22"
791373,hjypZf7Juayon8emI6HNSyjbqWF.jpg,"28,12,14","Determined to ensure Superman's ultimate sacrifice was not in vain, Bruce Wayne aligns forces with Diana Prince with plans to recruit a team of metahumans to protect the world from an approaching threat of catastrophic proportions.",86,tnAuB8q5vv7Ax9UAEje5Xi4BXik.jpg,2021-03-18,Zack Snyder's Justice League,4.08,9633,2024-04-13 00:00:00,en,242,Released,2024-04-13 00:00:00,"4083, 3125, 1931, 100, 394"
792307,bQS43HSLZzMjZkcHJz4fGc7fNdz.jpg,"878,10749,35","Brought back to life by an unorthodox scientist, a young woman runs off with a debauched lawyer on a whirlwind adventure across the continents. Free from the prejudices of her times, she grows steadfast in her purpose to stand for equality and liberation.",453,kCGlIMHnOm8JPXq3rXM6c5wMxcT.jpg,2023-12-07,Poor Things,3.9,2982,2024-04-13 00:00:00,en,142,Released,2024-04-13 00:00:00,"1605, 687, 6, 154, 530"
796499,bo4evsmoKb16AD1OhHgVOlgJtBw.jpg,"28,53,80,35",A mysterious woman recruits bank teller Ludwig Dieter to lead a group of aspiring thieves on a top-secret heist during the early stages of the zombie apocalypse.,71,iPTZGFmPs7HsXHYxiuxGolihjOH.jpg,2021-10-27,Army of Thieves,3.42,1875,2024-04-13 00:00:00,en,127,Released,2024-04-13 00:00:00,"962, 94, 126, 155, 538"
798141,1pFSJ9lxMYLkgLS5gmnwm1AEiqx.jpg,878,"Without warning, millions of mysterious alien “doors” suddenly appear around the globe. In a rush to determine the reason for their arrival, mankind must work together to understand the purpose of these cosmic anomalies.",77,pGPUXyhQTOqskKdDOD3Fmicqfc0.jpg,2021-03-23,Doors,2.5,158,2024-04-13 00:00:00,en,84,Released,2024-04-13 00:00:00,"35, 13, 25, 8, 77"
799155,ba9TgAO4I8RyA2LljzR3MspHaM9.jpg,"28,878,53","With the Parliament under siege, India’s first super soldier Arjun Shergill is tasked to get hold of the terrorists in the nick of time, save the Prime Minister from their clutches and stop a dirty bomb from exploding and destroying Delhi. Will Arjun succeed in his mission?",182,5jGKbYuZtdxSNOocI6ZziQeiY4n.jpg,2022-04-01,Attack,3.33,180,2024-04-13 00:00:00,en,123,Released,2024-04-13 00:00:00,"18, 94, 8, 49, 11"
799379,xkXsV1WOiKfAJ6dzXiavdwsZ3E2.jpg,"28,53,27,80","While under heavily armed guard, the dangerous convicts aboard a cargo ship unite in a coordinated escape attempt that soon escalates into a bloody, all-out riot. But as the fugitives continue their brutal campaign of terror, they soon discover that not even the most vicious among them is safe from the horror they unknowingly unleashed from the darkness below deck.",66,dniWicB6fa7NvpGbguxWlNPMc5f.jpg,2022-09-21,Project Wolf Hunting,3.2,302,2024-04-13 00:00:00,en,122,Released,2024-04-13 00:00:00,"132, 20, 34, 8, 108"
799710,xiAyufulheAWDWuZPVvV3Q9LIXc.jpg,"28,80","Woo-chul used to be a successful boxer, but he had to go to prison because his opponent died in the middle of a match. Now that he’s been released, he intends to become a model citizen. Meanwhile, his friend Do-shik will do whatever it takes to get ahead. After choosing different paths, they will be forced to plot against and betray one another.",145,t9GEcmN1ihe4qsGmhIEGvHT9ywY.jpg,2023-11-15,The Wild,2.6,10,2024-04-13 00:00:00,en,106,Released,2024-04-13 00:00:00,"2, 1, 2, 1, 4"
802219,1ZSKH5GGFlM8M32K34GMdaNS2Ew.jpg,"10402,36,18",Jamaican singer-songwriter Bob Marley overcomes adversity to become the most famous reggae musician in the world.,210,mKWalirPreEdCKDJjc5TKeOP2xi.jpg,2024-02-14,Bob Marley: One Love,3.52,451,2024-04-13 00:00:00,en,104,Released,2024-04-13 00:00:00,"193, 38, 111, 28, 81"
804150,a2tys4sD7xzVaogPntGsT1ypVoT.jpg,"53,35,80","Inspired by a true story, an oddball group of cops, criminals, tourists and teens converge in a Georgia forest where a 500-pound black bear goes on a murderous rampage after unintentionally ingesting cocaine.",90,gOnmaxHo0412UVr1QM5Nekv1xPi.jpg,2023-02-22,Cocaine Bear,3.05,1803,2024-04-13 00:00:00,en,95,Released,2024-04-13 00:00:00,"230, 498, 285, 712, 78"
807172,36Lt4NXw5ucLDobs7dvJCIniXCp.jpg,27,"Since his wife's death, Victor has raised his daughter Angela alone. After she and her friend return from a three-day disappearance with missing memories, they begin displaying frightening behavior reminiscent of the MacNeil possession fifty years prior.",107,fFXkAlMH2iQrNknv4eq7LGTkcti.jpg,2023-10-04,The Exorcist: Believer,3.01,859,2024-04-13 00:00:00,en,111,Released,2024-04-13 00:00:00,"245, 239, 13, 3, 359"
810693,921vUyXdfIYpaXqu5Lnf3nVb4IJ.jpg,"16,28,14","Yuta Okkotsu is a nervous high school student who is suffering from a serious problem—his childhood friend Rika has turned into a curse and won't leave him alone. Since Rika is no ordinary curse, his plight is noticed by Satoru Gojo, a teacher at Jujutsu High, a school where fledgling exorcists learn how to combat curses. Gojo convinces Yuta to enroll, but can he learn enough in time to confront the curse that haunts him?",70,23oJaeBh0FDk2mQ2P240PU9Xxfh.jpg,2021-12-24,Jujutsu Kaisen 0,4.1,1253,2024-04-13 00:00:00,en,105,Released,2024-04-13 00:00:00,"764, 151, 71, 233, 34"
811634,tv2xJzlQfwTHHls2ze8UeSheWgv.jpg,"16,28,14,10751","When the irritable monkey king visits a temple together with his master Tang Monk, he feels offended because of a trifle and thereupon accidentally destroys a magic tree growing on the sacred ground. This brings an ancient demon king back to life, who promptly kidnaps Tang Monk to take revenge for his long imprisonment. The monkey king and his followers have only three days to not only save their master but also to prevent the demon king from regaining his full powers and destroying the world…",57,67YXOoKGODyGvJXfXzVmgHNXYh8.jpg,2021-04-02,The Monkey King: Reborn,3.6,306,2024-04-13 00:00:00,en,95,Released,2024-04-13 00:00:00,"79, 86, 80, 61, 0"
812225,eUNg7wZ8HoQW0QxFjrfw3ioAkap.jpg,"16,14,28,12","As a lionhearted boy who can’t wield magic strives for the title of Wizard King, four banished Wizard Kings of yore return to crush the Clover Kingdom.",63,9YEGawvjaRgnyW6QVcUhFJPFDco.jpg,2023-06-16,Black Clover: Sword of the Wizard King,4.05,244,2024-04-13 00:00:00,en,113,Released,2024-04-13 00:00:00,"156, 18, 21, 24, 25"
816741,vDf9FmgCbn9YH4JGTpIsyiKX1fa.jpg,"28,878","In a post-apocalyptic future, mankind is color blind. A brilliant scientist suddenly dies, leaving his precious briefcase-filled with a highly-addictive synthetic drug that allows people to see colors again-to Ana, a mere 12-year-old girl. Possession of the briefcase makes her the target of a doctor with wicked plans for the drug, and her only hope to escape his pursuit relies on the aid of the dead scientist's two devoted bodyguards. Together, their epic, perilous journey pivots on a tremendous secret: Ana herself could be the key to salvaging a world in ruins.",93,5InVYa7CcbGioPvQ6ig4Lz4iLlR.jpg,2018-05-11,Grey Eyes,2.65,17,2024-04-13 00:00:00,en,100,Released,2024-04-13 00:00:00,"2, 5, 2, 1, 7"
818647,4rsomWxlqnHt3muGYK06auhOib6.jpg,"10749,18,35","Raquel's longtime crush on her next-door neighbor turns into something more when he starts developing feelings for her, despite his family's objections.",74,jmkpZvMVIRrMFevxzOubSBfG0s0.jpg,2022-02-04,Through My Window,3.69,2963,2024-04-13 00:00:00,en,112,Released,2024-04-13 00:00:00,"1250, 783, 232, 157, 541"
