11,4qCqAdHcNKeAHcK8tJ8wNJZa9cx.jpg,"12,28,878",Princess Leia is captured and held hostage by the evil Imperial forces in their effort to take over the galactic Empire. Venturesome Luke Skywalker and dashing captain Han Solo team together with the loveable robot duo R2-D2 and C-3PO to rescue the beautiful princess and restore peace and justice in the Empire.,102,6FfCtAuVAW8XJjZ7eWeLibRLWTw.jpg,1977-05-25,Star Wars,4.1,19847,2024-04-13 00:00:00,en,121,Released,2024-04-13 00:00:00,"10764, 3289, 3608, 1386, 800"
12,eCynaAOgYYiw5yN5lBwz3IxqvaW.jpg,"16,10751","Nemo, an adventurous young clownfish, is unexpectedly taken from his Great Barrier Reef home to a dentist's office aquarium. It's up to his worrisome father Marlin and a friendly but forgetful fish Dory to bring Nemo home -- meeting vegetarian sharks, surfer dude turtles, hypnotic jellyfish, hungry seagulls, and more along the way.",103,eHuGQ10FUzK1mdOY69wF5pGgEf5.jpg,2003-05-30,Finding Nemo,3.91,18614,2024-04-13 00:00:00,en,100,Released,2024-04-13 00:00:00,"9818, 1037, 5259, 1265, 1235"
13,qdIMHd4sEfJSckfVJfKQvisL02a.jpg,"35,18,10749","A man with a low IQ has accomplished great things in his life and been present during significant historic events—in each case, far exceeding what anyone imagined he could do. But despite all he has achieved, his one true love eludes him.",118,arw2vcBveWOVZr6pxd9XTd1TdQa.jpg,1994-06-23,Forrest Gump,4.24,26425,2024-04-13 00:00:00,en,142,Released,2024-04-13 00:00:00,"17766, 1709, 4621, 184, 2145"
15,ruF3Lmd4A8MHbnEBE6lxPMbsHGL.jpg,"9648,18","Newspaper magnate Charles Foster Kane is taken from his mother as a boy and made the ward of a rich industrialist. As a result, every well-meaning, tyrannical or self-destructive move he makes for the rest of his life appears in some way to be a reaction to that deeply wounding event.",36,sav0jxhqiH0bPr2vZFU0Kjt2nZL.jpg,1941-04-17,Citizen Kane,4,5255,2024-04-13 00:00:00,en,119,Released,2024-04-13 00:00:00,"2584, 1045, 1109, 76, 441"
18,gEFe2joIQUopBmMPXOHPxuX2f4u.jpg,"12,14,28,53,878","In 2257, a taxi driver is unintentionally given the task of saving a young girl who is part of the key that will ensure the survival of humanity.",70,fPtlCO1yQtnoLHOwKtWz7db6RGU.jpg,1997-05-02,The Fifth Element,3.77,10329,2024-04-13 00:00:00,en,126,Released,2024-04-13 00:00:00,"3028, 3623, 2020, 1590, 68"
22,wW7Wt5bXzPy4VOEE4LTIUDyDgBo.jpg,"12,14,28","Jack Sparrow, a freewheeling 18th-century pirate, quarrels with a rival pirate bent on pillaging Port Royal. When the governor's daughter is kidnapped, Sparrow decides to help the girl's love save her.",149,z8onk7LV9Mmw6zKz4hT6pzzvmvl.jpg,2003-07-09,Pirates of the Caribbean: The Curse of the Black Pearl,3.9,19876,2024-04-13 00:00:00,en,143,Released,2024-04-13 00:00:00,"10041, 3038, 2548, 3266, 983"
35,8ln5VUVk7gnNGIb2VNgw8nICDVt.jpg,"16,35,10751","After Homer accidentally pollutes the town's water supply, Springfield is encased in a gigantic dome by the EPA and the Simpsons are declared fugitives.",72,gzb6P78zeFTnv9eoFYnaJ2YrZ5q.jpg,2007-07-25,The Simpsons Movie,3.5,7686,2024-04-13 00:00:00,en,87,Released,2024-04-13 00:00:00,"2075, 2685, 1204, 452, 1270"
38,jz9Kep0xWjiA6QDHSsd43ASxNfj.jpg,"878,18,10749","Joel Barish, heartbroken that his girlfriend underwent a procedure to erase him from her memory, decides to do the same. However, as he watches his memories of her fade away, he realises that he still loves her, and may be too late to correct his mistake.",71,5MwkWH9tYHv3mV9OdYTMR5qreIz.jpg,2004-03-19,Eternal Sunshine of the Spotless Mind,4.05,14294,2024-04-13 00:00:00,en,108,Released,2024-04-13 00:00:00,"8796, 1926, 1173, 288, 2111"
58,vv5a8u6e40kyH0Hp6HuamAgzRai.jpg,"12,14,28",Captain Jack Sparrow works his way out of a blood debt with the ghostly Davy Jones to avoid eternal damnation.,120,uXEqmloGyP7UXAiphJUu2v2pcuE.jpg,2006-07-06,Pirates of the Caribbean: Dead Man's Chest,3.68,15339,2024-04-13 00:00:00,en,151,Released,2024-04-13 00:00:00,"3055, 7042, 3060, 1642, 540"
62,w5IDXtifKntw0ajv2co7jFlTQDM.jpg,"878,9648,12","Humanity finds a mysterious object buried beneath the lunar surface and sets off to find its origins with the help of HAL 9000, the world's most advanced super computer.",61,ve72VxNqjGM69Uky4WTo2bK6rfq.jpg,1968-04-02,2001: A Space Odyssey,4.04,11004,2024-04-13 00:00:00,en,149,Released,2024-04-13 00:00:00,"6132, 2357, 682, 489, 1344"
74,nH6hPhJq3EEv9CnBZgXU3IQnpJo.jpg,"12,53,878","Ray Ferrier is a divorced dockworker and less-than-perfect father. Soon after his ex-wife and her new husband drop off his teenage son and young daughter for a rare weekend visit, a strange and powerful lightning storm touches down.",55,6Biy7R9LfumYshur3YKhpj56MpB.jpg,2005-06-28,War of the Worlds,3.25,8027,2024-04-13 00:00:00,en,117,Released,2024-04-13 00:00:00,"2095, 2786, 392, 538, 2216"
78,eIi3klFf7mp3oL5EEF4mLIDs26r.jpg,"878,18,53","In the smog-choked dystopian Los Angeles of 2019, blade runner Rick Deckard is called out of retirement to terminate a quartet of replicants who have escaped to Earth seeking their creator for a way to extend their short life spans.",63,63N9uy8nd9j7Eog2axPQ8lbr3Wj.jpg,1982-06-25,Blade Runner,3.97,13251,2024-04-13 00:00:00,en,118,Released,2024-04-13 00:00:00,"7913, 1823, 868, 498, 2149"
81,ulVUa2MvnJAjAeRt7h23FFJVRKH.jpg,"12,16,14","After a global war, the seaside kingdom known as the Valley of the Wind remains one of the last strongholds on Earth untouched by a poisonous jungle and the powerful insects that guard it. Led by the courageous Princess Nausicaä, the people of the Valley engage in an epic struggle to restore the bond between humanity and Earth.",56,tcrkfB8SRPQCgwI88hQScua6nxh.jpg,1984-03-11,Nausicaä of the Valley of the Wind,3.97,3365,2024-04-13 00:00:00,en,117,Released,2024-04-13 00:00:00,"1540, 1038, 29, 662, 96"
85,c7Mjuip0jfHLY7x8ZSEriRj45cu.jpg,"12,28","When Dr. Indiana Jones – the tweed-suited professor who just happens to be a celebrated archaeologist – is hired by the government to locate the legendary Ark of the Covenant, he finds himself up against the entire Nazi regime.",83,ceG9VzoRAVGwivFU403Wc3AHRys.jpg,1981-06-12,Raiders of the Lost Ark,3.96,11950,2024-04-13 00:00:00,en,115,Released,2024-04-13 00:00:00,"5131, 3580, 1216, 1676, 347"
89,2Y7nbXrDtHwAfcTX7KBN0z40OAy.jpg,"12,28","In 1938, an art collector appeals to eminent archaeologist Dr. Indiana Jones to embark on a search for the Holy Grail. Indy learns that a medieval historian has vanished while searching for it, and the missing man is his own father, Dr. Henry Jones Sr.. He sets out to rescue his father by following clues in the old man's notebook, which his father had mailed to him before he went missing. Indy arrives in Venice, where he enlists the help of a beautiful academic, Dr. Elsa Schneider, along with Marcus Brody and Sallah. Together they must stop the Nazis from recovering the power of eternal life and taking over the world!",67,npUCnxl1fqgt3aQiMQq0iJdZMZp.jpg,1989-05-24,Indiana Jones and the Last Crusade,3.92,9707,2024-04-13 00:00:00,en,127,Released,2024-04-13 00:00:00,"5084, 1772, 170, 2352, 329"
98,4I14RDX6gZPpXkHmbcqvAKpn3Dw.jpg,"28,18,12","In the year 180, the death of emperor Marcus Aurelius throws the Roman Empire into chaos.  Maximus is one of the Roman army's most capable and trusted generals and a key advisor to the emperor.  As Marcus' devious son Commodus ascends to the throne, Maximus is set to be executed.  He escapes, but is captured by slave traders.  Renamed Spaniard and forced to become a gladiator, Maximus must battle to the death with other men for the amusement of paying audiences.",88,ty8TGRuvJLPUmAR1H1nRIsgwvim.jpg,2000-05-04,Gladiator,4.11,17699,2024-04-13 00:00:00,en,155,Released,2024-04-13 00:00:00,"11019, 940, 3672, 803, 1265"
101,jynfI114q3kOAbIiVjVfFFmttU2.jpg,"80,18,28","Léon, the top hit man in New York, has earned a rep as an effective ""cleaner"". But when his next-door neighbors are wiped out by a loose-cannon DEA agent, he becomes the unwilling custodian of 12-year-old Mathilda. Before long, Mathilda's thoughts turn to revenge, and she considers following in Léon's footsteps.",79,yI6X2cCM5YPJtxMhUd3dPGqDAhw.jpg,1994-09-14,Léon: The Professional,4.15,14218,2024-04-13 00:00:00,en,111,Released,2024-04-13 00:00:00,"8239, 1561, 3247, 653, 518"
103,6aoyUbvu0419XLKLIMoH0TkEicH.jpg,"80,18",A mentally unstable Vietnam War veteran works as a night-time taxi driver in New York City where the perceived decadence and sleaze feed his urge for violent action.,63,ekstpH614fwDX8DUln1a2Opz0N8.jpg,1976-02-09,Taxi Driver,4.08,11665,2024-04-13 00:00:00,en,114,Released,2024-04-13 00:00:00,"7182, 1965, 482, 341, 1695"
105,5bzPWQ2dFUl2aZKkp7ILJVVkRed.jpg,"12,35,878","Eighties teenager Marty McFly is accidentally sent back in time to 1955, inadvertently disrupting his parents' first meeting and attracting his mother's romantic interest. Marty must repair the damage to history by rekindling his parents' romance and - with the help of his eccentric inventor friend Doc Brown - return to 1985.",97,fNOH9f1aA7XRTzl1sAOx9iF553Q.jpg,1985-07-03,Back to the Future,4.16,19162,2024-04-13 00:00:00,en,116,Released,2024-04-13 00:00:00,"13270, 1778, 843, 451, 2820"
106,YL3GPOiDcNraIJOVDCZsoOBoDy.jpg,"878,28,12,53",A team of elite commandos on a secret mission in a Central American jungle come to find themselves hunted by an extraterrestrial warrior.,85,k3mW4qfJo6SKqe6laRyNGnbB9n5.jpg,1987-06-12,Predator,3.76,7647,2024-04-13 00:00:00,en,107,Released,2024-04-13 00:00:00,"3966, 1318, 391, 505, 1467"
107,zfDunJqllYI4V5XE2PkKo3mZk6x.jpg,"80,35","Unscrupulous boxing promoters, violent bookmakers, a Russian gangster, incompetent amateur robbers and supposedly Jewish jewelers fight to track down a priceless stolen diamond.",57,56mOJth6DJ6JhgoE2jtpilVqJO.jpg,2000-09-01,Snatch,3.9,8648,2024-04-13 00:00:00,en,103,Released,2024-04-13 00:00:00,"4172, 1936, 1076, 431, 1033"
111,sctvs9cUwJD15qlTlrsh2BXsK75.jpg,"28,80,18","After getting a green card in exchange for assassinating a Cuban government official, Tony Montana stakes a claim on the drug trade in Miami. Viciously murdering anyone who stands in his way, Tony eventually becomes the biggest drug lord in the state, controlling nearly all the cocaine that comes through Miami. But increased pressure from the police, wars with Colombian drug cartels and his own drug-fueled paranoia serve to fuel the flames of his eventual downfall.",84,iQ5ztdjvteGeboxtmRdXEChJOHh.jpg,1983-12-09,Scarface,4.08,11261,2024-04-13 00:00:00,en,169,Released,2024-04-13 00:00:00,"6667, 1218, 2112, 137, 1127"
114,3tuWpnCTe14zZZPt6sI1W9ByOXx.jpg,"35,10749","When a millionaire wheeler-dealer enters a business contract with a Hollywood hooker Vivian Ward, he loses his heart in the bargain.",53,hVHUfT801LQATGd26VPzhorIYza.jpg,1990-03-23,Pretty Woman,3.73,7828,2024-04-13 00:00:00,en,119,Released,2024-04-13 00:00:00,"3703, 1756, 60, 1170, 1139"
118,bSvUW4JQ6g4QiKvwejcfcPRd4Ke.jpg,"12,35,10751,14","A young boy wins a tour through the most magnificent chocolate factory in the world, led by the world's most unusual candy maker.",151,wfGfxtBkhBzQfOZw4S8IQZgrH0a.jpg,2005-07-13,Charlie and the Chocolate Factory,3.53,14654,2024-04-13 00:00:00,en,115,Released,2024-04-13 00:00:00,"5061, 5056, 117, 1428, 2992"
120,x2RS3uTcsJJ9IfjNPcgDmukoEcQ.jpg,"12,14,28","Young hobbit Frodo Baggins, after inheriting a mysterious ring from his uncle Bilbo, must leave his home in order to keep it from falling into the hands of its evil creator. Along the way, a fellowship is formed to protect the ringbearer and make sure that the ring arrives at its final destination: Mt. Doom, the only place where it can be destroyed.",142,6oom5QYQ2yQTMJIbnvbkBL9cHo6.jpg,2001-12-18,The Lord of the Rings: The Fellowship of the Ring,4.21,24179,2024-04-13 00:00:00,en,179,Released,2024-04-13 00:00:00,"15791, 2561, 2268, 2231, 1328"
121,6G73mNyooWAEQTpckPSnFxFoNmc.jpg,"12,14,28","Frodo and Sam are trekking to Mordor to destroy the One Ring of Power while Gimli, Legolas and Aragorn search for the orc-captured Merry and Pippin. All along, nefarious wizard Saruman awaits the Fellowship members at the Orthanc Tower in Isengard.",106,5VTN0pR8gcqV3EPUHHfMGnJYN9L.jpg,2002-12-18,The Lord of the Rings: The Two Towers,4.2,21011,2024-04-13 00:00:00,en,179,Released,2024-04-13 00:00:00,"11913, 4471, 2484, 1202, 941"
122,2u7zbn8EudG6kLlBzUYqP8RyFU4.jpg,"12,14,28","Aragorn is revealed as the heir to the ancient kings as he, Gandalf and the other members of the broken fellowship struggle to save Gondor from Sauron's forces. Meanwhile, Frodo and Sam take the ring closer to the heart of Mordor, the dark lord's realm.",110,rCzpDGLbOoPwLjy3OAm5NUPOTrC.jpg,2003-12-01,The Lord of the Rings: The Return of the King,4.25,23238,2024-04-13 00:00:00,en,201,Released,2024-04-13 00:00:00,"14660, 3705, 1887, 1994, 992"
128,gl0jzn4BupSbL2qMVeqrjKkF9Js.jpg,"12,14,16","Ashitaka, a prince of the disappearing Emishi people, is cursed by a demonized boar god and must journey to the west to find a cure. Along the way, he encounters San, a young human woman fighting to protect the forest, and Lady Eboshi, who is trying to destroy it. Ashitaka must find a way to bring balance to this conflict.",90,cMYCDADoLKLbB83g4WnJegaZimC.jpg,1997-07-12,Princess Mononoke,4.17,7617,2024-04-13 00:00:00,en,134,Released,2024-04-13 00:00:00,"4934, 782, 320, 1423, 158"
129,mSDsSDwaP3E7dEfUPWy4J0djt4O.jpg,"16,10751,14","A young girl, Chihiro, becomes trapped in a strange new world of spirits. When her parents undergo a mysterious transformation, she must call upon the courage she never knew she had to free her family.",113,39wmItIWsg5sZMyRUHLkWBcuVCM.jpg,2001-07-20,Spirited Away,4.25,15766,2024-04-13 00:00:00,en,125,Released,2024-04-13 00:00:00,"11181, 809, 329, 3430, 17"
141,msCHK5Kh1YbdZ0zPJ2nzPUhhSN9.jpg,"14,18,9648","After narrowly escaping a bizarre accident, a troubled teenager is plagued by visions of a large bunny rabbit that manipulates him to commit a series of crimes.",53,fhQoQfejY1hUcwyuLgpBrYs6uFt.jpg,2001-01-19,Donnie Darko,3.89,11923,2024-04-13 00:00:00,en,114,Released,2024-04-13 00:00:00,"4742, 2441, 3756, 654, 330"
155,dqK9Hag1054tghRQSqLSfrkvQnA.jpg,"18,28,80,53","Batman raises the stakes in his war on crime. With the help of Lt. Jim Gordon and District Attorney Harvey Dent, Batman sets out to dismantle the remaining criminal organizations that plague the streets. The partnership proves to be effective, but they soon find themselves prey to a reign of chaos unleashed by a rising criminal mastermind known to the terrified citizens of Gotham as the Joker.",97,qJ2tW6WMUDux911r6m7haRef0WH.jpg,2008-07-16,The Dark Knight,4.26,31725,2024-04-13 00:00:00,en,152,Released,2024-04-13 00:00:00,"22074, 1060, 3457, 5033, 101"
161,boI3myFhWBvQcru4zZ15aJ0u3CX.jpg,"53,80","Less than 24 hours into his parole, charismatic thief Danny Ocean is already rolling out his next plan: In one night, Danny's hand-picked crew of specialists will attempt to steal more than $150 million from three Las Vegas casinos. But to score the cash, Danny risks his chances of reconciling with ex-wife, Tess.",86,hQQCdZrsHtZyR6NbKH2YyCqd2fR.jpg,2001-12-07,Ocean's Eleven,3.72,11161,2024-04-13 00:00:00,en,116,Released,2024-04-13 00:00:00,"4649, 1238, 2859, 2329, 86"
162,3Nn5BOM1EVw1IYrv6MsbOS6N1Ol.jpg,"14,18,10749",A small suburban town receives a visit from a castaway unfinished science experiment named Edward.,71,e0FqKFvGPdQNWG8tF9cZBtev9Em.jpg,1990-12-07,Edward Scissorhands,3.86,12465,2024-04-13 00:00:00,en,105,Released,2024-04-13 00:00:00,"7165, 1096, 555, 2591, 1058"
165,skQN2UMQKQnOTmwplcYMx6ZF4jS.jpg,"12,35,878","Marty and Doc are at it again in this wacky sequel to the 1985 blockbuster as the time-traveling duo head to 2015 to nip some McFly family woes in the bud. But things go awry thanks to bully Biff Tannen and a pesky sports almanac. In a last-ditch attempt to set things straight, Marty finds himself bound for 1955 and face to face with his teenage parents -- again.",78,hQq8xZe5uLjFzSBt4LanNP7SQjl.jpg,1989-11-22,Back to the Future Part II,3.88,12282,2024-04-13 00:00:00,en,108,Released,2024-04-13 00:00:00,"7472, 610, 7, 3640, 553"
169,7PoWlbQg7ZxgwofFRrkytvpLvJD.jpg,"878,28,53",A police chief in the war-torn streets of Los Angeles discovers that an extraterrestrial creature is hunting down residents - and that he is the next target.,55,83X4VwY9sdSJykskmsplIVG0a4h.jpg,1990-11-21,Predator 2,3.14,3073,2024-04-13 00:00:00,en,108,Released,2024-04-13 00:00:00,"1079, 511, 6, 715, 762"
185,nLFxvLokHe3bQmrmAfljIfax2jQ.jpg,"878,80","In a near-future Britain, young Alexander DeLarge and his pals get their kicks beating and raping anyone they please. When not destroying the lives of others, Alex swoons to the music of Beethoven. The state, eager to crack down on juvenile crime, gives an incarcerated Alex the option to undergo an invasive procedure that'll rob him of all personal agency. In a time when conscience is a commodity, can Alex change his tune?",55,4sHeTAp65WrSSuc05nRBKddhBxO.jpg,1971-12-19,A Clockwork Orange,4.1,12391,2024-04-13 00:00:00,en,137,Released,2024-04-13 00:00:00,"6656, 2371, 1440, 1795, 129"
197,8lBcqakI3F19NWkXdqE0M8W76b9.jpg,"28,18,36,10752","Enraged at the slaughter of Murron, his new bride and childhood love, Scottish warrior William Wallace slays a platoon of the local English lord's soldiers. This leads the village to revolt and, eventually, the entire country to rise up against English rule.",59,or1gBugydmjToAEq7OZY0owwFk.jpg,1995-05-24,Braveheart,3.97,9700,2024-04-13 00:00:00,en,177,Released,2024-04-13 00:00:00,"6066, 1212, 354, 201, 1867"
217,bXH4lyFS6tctnBgxK1eYRuwekR0.jpg,"12,28","Set during the Cold War, the Soviets—led by sword-wielding Irina Spalko—are in search of a crystal skull which has supernatural powers related to a mystical Lost City of Gold. Indy is coerced to head to Peru at the behest of a young man whose friend—and Indy's colleague—Professor Oxley has been captured for his knowledge of the skull's whereabouts.",53,56As6XEM1flWvprX4LgkPl8ii4K.jpg,2008-05-21,Indiana Jones and the Kingdom of the Crystal Skull,3,7950,2024-04-13 00:00:00,en,122,Released,2024-04-13 00:00:00,"1757, 1280, 870, 3292, 751"
218,6dpnthrofbqWmvapUyvqCrkdHG.jpg,"28,53,878","In the post-apocalyptic future, reigning tyrannical supercomputers teleport a cyborg assassin known as the ""Terminator"" back to 1984 to kill Sarah Connor, whose unborn son is destined to lead insurgents against 21st century mechanical hegemony. Meanwhile, the human-resistance movement dispatches a lone warrior to safeguard Sarah. Can he stop the virtually indestructible killing machine?",74,qvktm0BHcnmDpul4Hz01GIazWPr.jpg,1984-10-26,The Terminator,3.83,12408,2024-04-13 00:00:00,en,108,Released,2024-04-13 00:00:00,"4688, 2957, 3614, 263, 886"
238,tmU7GeKVybMWFButWEGl2M4GeiP.jpg,"18,80","Spanning the years 1945 to 1955, a chronicle of the fictional Italian-American Corleone crime family. When organized crime family patriarch, Vito Corleone barely survives an attempt on his life, his youngest son, Michael steps in to take care of the would-be killers, launching a campaign of bloody revenge.",122,3bhkrj58Vtu7enYsRolD1fZdja1.jpg,1972-03-14,The Godfather,4.35,19669,2024-04-13 00:00:00,en,175,Released,2024-04-13 00:00:00,"14305, 1016, 2457, 709, 1182"
240,kGzFbGhp99zva6oZODW5atUtnqi.jpg,"18,80","In the continuing saga of the Corleone crime family, a young Vito Corleone grows up in Sicily and in 1910s New York. In the 1950s, Michael Corleone attempts to expand the family business into Las Vegas, Hollywood and Cuba.",80,hek3koDUyRQk7FIhPXsa6mT2Zc3.jpg,1974-12-20,The Godfather Part II,4.29,11882,2024-04-13 00:00:00,en,202,Released,2024-04-13 00:00:00,"8822, 1220, 1, 141, 1698"
242,zNnjHLDtV8Ti3aworltaeaLMov4.jpg,"80,18,53","In the midst of trying to legitimize his business dealings in 1979 New York and Italy, aging mafia don, Michael Corleone seeks forgiveness for his sins while taking a young protege under his wing.",107,lm3pQ2QoQ16pextRsmnUbG2onES.jpg,1990-12-25,The Godfather Part III,3.71,5893,2024-04-13 00:00:00,en,162,Released,2024-04-13 00:00:00,"2769, 545, 1213, 833, 533"
252,idfNNlVwjVkBQrM2eWpLZiDOTIc.jpg,"10751,14,35","When eccentric candy man Willy Wonka promises a lifetime supply of sweets and a tour of his chocolate factory to five lucky kids, penniless Charlie Bucket seeks the golden ticket that will make him a winner.",93,vmpsZkrs4Uvkp9r1atL8B3frA63.jpg,1971-06-29,Willy Wonka & the Chocolate Factory,3.75,3379,2024-04-13 00:00:00,en,99,Released,2024-04-13 00:00:00,"1297, 817, 654, 345, 266"
254,14xx5Tf58mD8FRJ1B3BspiLiRxz.jpg,"12,18,28","In 1933 New York, an overly ambitious movie producer coerces his cast and hired ship crew to travel to mysterious Skull Island, where they encounter Kong, a giant ape who is immediately smitten with the leading lady.",203,4fNOp3itFBw7L28kAHxwRPqyZ2K.jpg,2005-12-12,King Kong,3.44,7568,2024-04-13 00:00:00,en,187,Released,2024-04-13 00:00:00,"1822, 2796, 635, 1519, 796"
272,lh5lbisD4oDbEKgUxoRaZU8HVrk.jpg,"28,80,18","Driven by tragedy, billionaire Bruce Wayne dedicates his life to uncovering and defeating the corruption that plagues his home, Gotham City.  Unable to work within the system, he instead creates a new identity, a symbol of fear for the criminal underworld - The Batman.",56,4MpN4kIEqUjW8OPtOQJXlTdHiJV.jpg,2005-06-10,Batman Begins,3.85,20235,2024-04-13 00:00:00,en,140,Released,2024-04-13 00:00:00,"7482, 5913, 4287, 1428, 1125"
275,747dgDfL5d8esobk7h4odaOFhUq.jpg,"80,18,53","Jerry, a small-town Minnesota car salesman is bursting at the seams with debt... but he's got a plan. He's going to hire two thugs to kidnap his wife in a scheme to collect a hefty ransom from his wealthy father-in-law. It's going to be a snap and nobody's going to get hurt... until people start dying. Enter Police Chief Marge, a coffee-drinking, parka-wearing - and extremely pregnant - investigator who'll stop at nothing to get her man. And if you think her small-time investigative skills will give the crooks a run for their ransom... you betcha!",73,rt7cpEr1uP6RTZykBFhBTcRaKvG.jpg,1996-03-08,Fargo,3.93,7678,2024-04-13 00:00:00,en,98,Released,2024-04-13 00:00:00,"3395, 2100, 798, 1020, 365"
278,kXfqcdQKsToO0OUXHcrrNCHDBzO.jpg,"18,80","Framed in the 1940s for the double murder of his wife and her lover, upstanding banker Andy Dufresne begins a new life at the Shawshank prison, where he puts his accounting skills to work for an amoral warden. During his long stretch in prison, Dufresne comes to be admired by the other inmates -- including an older prisoner named Red -- for his integrity and unquenchable sense of hope.",149,9cqNxx0GxF0bflZmeSMuL5tnGzr.jpg,1994-09-23,The Shawshank Redemption,4.35,25942,2024-04-13 00:00:00,en,142,Released,2024-04-13 00:00:00,"17375, 2485, 3892, 2166, 24"
280,8MksSPtPvqcSDruLdpibPmTP7LY.jpg,"28,53,878","Set ten years after the events of the original, James Cameron’s classic sci-fi action flick tells the story of a second attempt to get the rid of rebellion leader John Connor, this time targeting the boy himself. However, the rebellion has sent a reprogrammed terminator to protect Connor.",71,5M0j0B18abtBI5gi2RhfjjurTqb.jpg,1991-07-03,Terminator 2: Judgment Day,4.06,12278,2024-04-13 00:00:00,en,137,Released,2024-04-13 00:00:00,"6257, 2851, 1081, 1827, 262"
285,kPcHuPYqzkSo4bmPHtH82GaeEgX.jpg,"12,14,28","Captain Barbossa, long believed to be dead, has come back to life and is headed to the edge of the Earth with Will Turner and Elizabeth Swann. But nothing is quite as it seems.",121,jGWpG4YhpQwVmjyHEGkxEkeRf0S.jpg,2007-05-19,Pirates of the Caribbean: At World's End,3.65,13783,2024-04-13 00:00:00,en,169,Released,2024-04-13 00:00:00,"3375, 5678, 2726, 538, 1466"
297,uMBByiSDpgFwWVegAtwwnuzvogJ.jpg,"14,18,10749","When the grim reaper comes to collect the soul of megamogul Bill Parrish, he arrives with a proposition: Host him for a ""vacation"" among the living in trade for a few more days of existence. Parrish agrees, and using the pseudonym Joe Black, Death begins taking part in Parrish's daily agenda and falls in love with the man's daughter. Yet when Black's holiday is over, so is Parrish's life.",64,fDPAjvfPMomkKF7cMRmL5Anak61.jpg,1998-11-12,Meet Joe Black,3.66,4862,2024-04-13 00:00:00,en,178,Released,2024-04-13 00:00:00,"2044, 904, 230, 1584, 100"
311,uPYa165sraN2c8gZBM9C47g3JoU.jpg,"18,80","A former Prohibition-era Jewish gangster returns to the Lower East Side of Manhattan over thirty years later, where he once again must confront the ghosts and regrets of his old life.",47,i0enkzsL5dPeneWnjl1fCWm6L7k.jpg,1984-05-23,Once Upon a Time in America,4.21,5126,2024-04-13 00:00:00,en,229,Released,2024-04-13 00:00:00,"3212, 710, 312, 852, 40"
345,vYA4qUPWY0EbjpcIXAL4h4pVmTC.jpg,"18,53,9648","After Dr. Bill Harford's wife, Alice, admits to having sexual fantasies about a man she met, Bill becomes obsessed with having a sexual encounter. He discovers an underground sexual group and attends one of their meetings -- and quickly discovers that he is in over his head.",62,knEIz1eNGl5MQDbrEAVWA7iRqF9.jpg,1999-07-16,Eyes Wide Shut,3.74,5855,2024-04-13 00:00:00,en,159,Released,2024-04-13 00:00:00,"2002, 1532, 1257, 924, 140"
348,hdHIjZxq3SWFqpAz4NFhdbud0iz.jpg,"27,878","During its return to the earth, commercial spaceship Nostromo intercepts a distress signal from a distant planet. When a three-member team of the crew discovers a chamber containing thousands of eggs on the planet, a creature inside one of the eggs attacks an explorer. The entire crew is unaware of the impending nightmare set to descend upon them when the alien parasite planted inside its unfortunate host is birthed.",103,vfrQk5IPloGg1v9Rzbh2Eg3VGyM.jpg,1979-05-25,Alien,4.08,13795,2024-04-13 00:00:00,en,117,Released,2024-04-13 00:00:00,"7105, 2683, 2100, 1819, 88"
